### ISSUE TITLE
handle errors properly

### ISSUE THREAD

**Issue by celesteking** [iande/onstomp#9]
It doesn't handle errors returned form broker. Thing finishes successfully while it should alert like hell. Also I wonder why broker send that error as all access params were configured correctly. tcpdump attached.

Here's the code:
<code>
client = OnStomp.connect('stomp://xxx:6163', opts)

scope = client.with_receipt do |r|
  puts "Got my receipt!"
end

scope.send '/queue/testo', 'walks in to the room'
</code>

<code>
01:13:09.987833 IP 192.168.88.102.46657 > xxx.6163: S 945257220:945257220(0) win 5840 <mss 1460,sackOK,timestamp 439263393 0,nop,wscale 7>
E..<..@.@.._..Xf.V.Q.A..8W{....................
............
01:13:10.133726 IP xxx.6163 > 192.168.88.102.46657: S 1950693974:1950693974(0) ack 945257221 win 5840 <mss 1460,nop,nop,sackOK>
E..0..@.5....V.Q..Xf...AtE:V8W{.p....;..........
01:13:10.133763 IP 192.168.88.102.46657 > xxx.6163: . ack 1 win 5840
E..(..@.@..r..Xf.V.Q.A..8W{.tE:WP.......
01:13:10.134141 IP 192.168.88.102.46657 > xxx.6163: P 1:100(99) ack 1 win 5840
E.....@.@.....Xf.V.Q.A..8W{.tE:WP....H..CONNECT
login:tester
heart-beat:0,0
passcode:sdfsdf
host:broker.yyy
accept-version:1.0,1.1

.
01:13:10.279916 IP xxx.6163 > 192.168.88.102.46657: . ack 100 win 5840
E..(v.@.5.@@.V.Q..Xf...AtE:W8W{hP............J
01:13:10.286294 IP xxx.6163 > 192.168.88.102.46657: P 1:67(66) ack 100 win 5840
E..jv.@.5.?..V.Q..Xf...AtE:W8W{hP...=...CONNECTED
session:ID:broker.yyy-49796-1303594934541-4:58

.

01:13:10.286309 IP 192.168.88.102.46657 > xxx.6163: . ack 67 win 5840
E..(..@.@..p..Xf.V.Q.A..8W{htE:.P.......
01:13:10.387027 IP 192.168.88.102.46657 > xxx.6163: P 100:180(80) ack 67 win 5840
E..x..@.@.....Xf.V.Q.A..8W{htE:.P....T..SEND
destination:/queue/testo
receipt:1
content-length:20

walks in to the room.
01:13:10.535728 IP xxx.6163 > 192.168.88.102.46657: . 67:1527(1460) ack 180 win 5840
E...v.@.5.:..V.Q..Xf...AtE:.8W{.P....3..ERROR
message:User tester is not authorized to write to: queue://testo
receipt-id:1

java.lang.SecurityException: User tester is not authorized to write to: queue://testo
        at org.apache.activemq.security.AuthorizationBroker.send(AuthorizationBroker.java:187)
        at org.apache.activemq.broker.MutableBrokerFilter.send(MutableBrokerFilter.java:135)
        at org.apache.activemq.broker.TransportConnection.processMessage(TransportConnection.java:460)
        at org.apache.activemq.command.ActiveMQMessage.visit(ActiveMQMessage.java:663)
        at org.apache.activemq.broker.TransportConnection.service(TransportConnection.java:309)
        at org.apache.activemq.broker.TransportConnection$1.onCommand(TransportConnection.java:185)
        at org.apache.activemq.transport.TransportFilter.onCommand(TransportFilter.java:69)
        at org.apache.activemq.transport.stomp.StompTransportFilter.sendToActiveMQ(StompTransportFilter.java:81)
        at org.apache.activemq.transport.stomp.ProtocolConverter.sendToActiveMQ(ProtocolConverter.java:140)
        at org.apache.activemq.transport.stomp.ProtocolConverter.onStompSend(ProtocolConverter.java:253)
        at org.apache.activemq.transport.stomp.ProtocolConverter.onStompCommand(ProtocolConverter.java:178)
        at org.apache.activemq.transport.stomp.StompTransportFilter.onCommand(StompTransportFilter.java:70)
        at org.apache.activemq.transport.TransportSupport.doConsume(TransportSupport.java:83)
        at org.apache.activemq.transport.tcp.TcpTrans
01:13:10.535775 IP 192.168.88.102.46657 > xxx.6163: . ack 1527 win 8760
E..(..@.@..n..Xf.V.Q.A..8W{.tE@MP."8....
01:13:10.535784 IP xxx.6163 > 192.168.88.102.46657: P 1527:1651(124) ack 180 win 5840
E...v.@.5.?..V.Q..Xf...AtE@M8W{.P.......)
        at org.apache.activemq.transport.tcp.TcpTransport.run(TcpTransport.java:201)
        at java.lang.Thread.run(Thread.java:662)
</code>
